[
  {
    "name": "GitHub Campus Expert",
    "company": "GitHub",
    "apply_url": "https://github.com/education/students/campus-expert",
    "status": "Closed",
    "role_type": "Student Expert/Leader",
    "domain": "Tech",
    "eligibility_summary": "Students enrolled in a degree-granting institution",
    "location_notes": "Global (virtual with local events)",
    "compensation_bucket": "Unpaid-or-perks",
    "last_verified": "2026-10-17",
    "short_description": "People learn better when they can learn with a community of likeminded peers. Campus Experts are student leaders that strive to build diverse and inclusive spaces to learn skills, share their experiences, and build projects together. They can be found across the globe leading in-person and online co",
    "source_url": "https://github.com/campus-experts?locale=en-US",
    "source_snippet": "GitHub Campus Experts · GitHub Skip to content Navigation Menu Sign in Appearance settings campus-experts Platform AI CODE CREATION GitHub Copilot Write better code with AI GitHub Copilot app Direct agents from issue to merge MCP Registry Integrate external tools DEVELOPER WOR...",
    "school_restricted": false,
    "notes": "Parsed from github.com/education campus expert page (Phase 1 hybrid scraper).",
    "id": "324287a8-ad23-565d-842f-a5c075734807"
  },
  {
    "id": "84850930-40ad-5591-a1b3-e1f83fe611b5",
    "name": "Adobe Creative Cloud Fellowship",
    "company": "Adobe",
    "apply_url": "https://www.adobe.com/education/students/creative-cloud-fellowship.html",
    "status": "Closed",
    "role_type": "Fellowship/Scholarship-adjacent",
    "domain": "Design/Creative",
    "eligibility_summary": "Undergraduate and graduate students studying design, digital media, or related fields",
    "location_notes": "Hybrid - virtual meetings with annual summit in San Francisco",
    "compensation_bucket": "Paid",
    "last_verified": "2026-08-07",
    "short_description": "Immersive fellowship program for students to develop professional creative skills using Adobe Creative Cloud",
    "responsibilities": [
      "Complete real-world client projects using Adobe tools",
      "Participate in weekly skill-building workshops",
      "Mentor high school students in digital literacy",
      "Present final capstone project at Adobe summit"
    ],
    "time_commitment": "15-20 hours/week",
    "perks_detail": "Stipend, Adobe Creative Cloud license, professional development budget, summer internship interview guarantee",
    "deadlines": {
      "application": "2024-01-15",
      "program_start": "2024-06-01",
      "program_end": "2024-12-15"
    },
    "social_requirements": "Monthly blog posts about learning journey using #AdobeFellow",
    "source_url": "https://www.adobe.com/education/students/creative-cloud-fellowship.html",
    "source_snippet": "The Adobe Creative Cloud Fellowship is a comprehensive program that helps students develop professional-grade creative skills.",
    "school_restricted": false,
    "notes": "Fellowship runs June to December with applications in winter\n\nArchived 2026-08-07 (allowlist audit #11): apply_url https://www.adobe.com/education/students/creative-cloud-fellowship.html returned HTTP 404. No public replacement program page found; treated as unreal/dead sample record."
  },
  {
    "id": "7e072019-78ee-554a-a74b-496aaa552e4f",
    "name": "Adobe Design Circle",
    "company": "Adobe",
    "apply_url": "https://www.adobe.com/education/students/design-circle.html",
    "status": "Closed",
    "role_type": "Creator/Influencer",
    "domain": "Design/Creative",
    "eligibility_summary": "Undergraduate students passionate about design and visual storytelling",
    "location_notes": "Remote/virtual with optional regional meetups",
    "compensation_bucket": "Unpaid-or-perks",
    "last_verified": "2026-08-07",
    "short_description": "Global community of student designers who collaborate on projects and attend exclusive Adobe events",
    "responsibilities": [
      "Create design projects using Adobe tools for monthly challenges",
      "Participate in virtual design critiques and workshops",
      "Collaborate with peers on cross-campus design projects",
      "Share work and provide feedback in the Design Circle community"
    ],
    "time_commitment": "5-10 hours/week",
    "perks_detail": "Free Adobe Creative Cloud subscription, access to exclusive events, portfolio review opportunities, featured in Adobe galleries",
    "deadlines": {
      "application": "2024-02-01",
      "program_start": "2024-03-01",
      "program_end": "2024-11-30"
    },
    "social_requirements": "Share one project per month using #AdobeDesignCircle",
    "source_url": "https://www.adobe.com/education/students/design-circle.html",
    "source_snippet": "The Adobe Design Circle brings together student designers from around the world to collaborate, learn, and grow their skills.",
    "school_restricted": false,
    "notes": "Design Circle runs March to November with rolling admissions\n\nArchived 2026-08-07 (allowlist audit #11): apply_url https://www.adobe.com/education/students/design-circle.html returned HTTP 404. No public replacement program page found; treated as unreal/dead sample record."
  },
  {
    "id": "1c72a7c6-5575-57fb-8c69-a367f4f21d07",
    "name": "Adobe University Outreach",
    "company": "Adobe",
    "apply_url": "https://www.adobe.com/education/students/university-outreach.html",
    "status": "Closed",
    "role_type": "Organizer/Coach",
    "domain": "Education/EdTech",
    "eligibility_summary": "Graduate students or faculty members in computer science, design, or related fields",
    "location_notes": "Campus-based (various locations)",
    "compensation_bucket": "Unpaid-or-perks",
    "last_verified": "2026-08-07",
    "short_description": "Program to help educators and student leaders bring Adobe workshops and resources to their campuses",
    "responsibilities": [
      "Organize Adobe workshops and training sessions on campus",
      "Act as liaison between Adobe and academic departments",
      "Gather feedback on educational needs for product development",
      "Report on student engagement and learning outcomes"
    ],
    "time_commitment": "5-15 hours/week",
    "perks_detail": "Access to Adobe educational resources, travel stipends for events, professional development opportunities",
    "deadlines": {
      "application": "2024-01-15",
      "program_start": "2024-02-01",
      "program_end": "2024-12-31"
    },
    "social_requirements": "Post event highlights using #AdobeOnCampus",
    "source_url": "https://www.adobe.com/education/students/university-outreach.html",
    "source_snippet": "Adobe University Outreach empowers educators and student leaders to bring creative technology to campuses worldwide.",
    "school_restricted": true,
    "notes": "Academic year program with flexible start dates\n\nArchived 2026-08-07 (allowlist audit #11): apply_url https://www.adobe.com/education/students/university-outreach.html returned HTTP 404. No public replacement program page found; treated as unreal/dead sample record."
  },
  {
    "id": "07251db3-853b-52b6-864a-192923196f56",
    "name": "Adobe Ideapalooza",
    "company": "Adobe",
    "apply_url": "https://www.adobe.com/education/students/ideapalooza.html",
    "status": "Closed",
    "role_type": "Creator/Influencer",
    "domain": "Design/Creative",
    "eligibility_summary": "Students aged 13+ enrolled in accredited educational institutions",
    "location_notes": "Virtual competition",
    "compensation_bucket": "Unpaid-or-perks",
    "last_verified": "2026-08-07",
    "short_description": "Annual global design competition for students to solve real-world challenges using Adobe tools",
    "responsibilities": [
      "Create innovative design solutions to challenge briefs",
      "Submit projects using Adobe Creative Cloud tools",
      "Participate in virtual judging and feedback sessions",
      "Attend winner announcement event (virtual or in-person)"
    ],
    "time_commitment": "Flexible/project-based",
    "perks_detail": "Software licenses, feature in Adobe gallery, mentorship opportunities, cash prizes for winners",
    "deadlines": {
      "application": "2024-09-01",
      "competition_start": "2024-09-15",
      "winner_announcement": "2024-10-15"
    },
    "social_requirements": "Share process and final work using #AdobeIdeapalooza",
    "source_url": "https://www.adobe.com/education/students/ideapalooza.html",
    "source_snippet": "Adobe Ideapalooza challenges students to use creativity and technology to make a positive impact.",
    "school_restricted": false,
    "notes": "Annual competition cycle: September to October\n\nArchived 2026-08-07 (allowlist audit #11): apply_url https://www.adobe.com/education/students/ideapalooza.html returned HTTP 404. No public replacement program page found; treated as unreal/dead sample record."
  },
  {
    "name": "Apple Education",
    "short_description": "For a limited time, get a gift card up to $150Δwhen you buy Mac or iPad with education savings.Shop...",
    "company": "Apple",
    "apply_url": "https://www.apple.com/education/",
    "status": "Closed",
    "role_type": "Ambassador",
    "domain": "Tech",
    "eligibility_summary": "Currently enrolled college or university students",
    "location_notes": "Campus-based (varies by location)",
    "compensation_bucket": "Unpaid-or-perks",
    "last_verified": "2026-08-07",
    "responsibilities": [
      "Host Apple product workshops and demos on campus",
      "Help students and faculty with Apple technology questions",
      "Create content showcasing creative uses of Apple products",
      "Gather feedback from campus community about Apple products"
    ],
    "time_commitment": "5-15 hours/week",